No.     Time        Source                Destination           Protocol Length Info
      3 2.952217    128.131.210.185       128.131.210.185       GIOP     326    GIOP 1.2 Request s=258 id=10: op=InsertTestEntities

Frame 3: 326 bytes on wire (2608 bits), 326 bytes captured (2608 bits)
Null/Loopback
Internet Protocol Version 4, Src: 128.131.210.185 (128.131.210.185), Dst: 128.131.210.185 (128.131.210.185)
Transmission Control Protocol, Src Port: 52403 (52403), Dst Port: lrs-paging (3700), Seq: 1, Ack: 1, Len: 270
General Inter-ORB Protocol
General Inter-ORB Protocol Request

No.     Time        Source                Destination           Protocol Length Info
      4 2.952315    128.131.210.185       128.131.210.185       TCP      56     lrs-paging > 52403 [ACK] Seq=1 Ack=271 Win=65535 Len=0 TSval=122855426 TSecr=122855426

Frame 4: 56 bytes on wire (448 bits), 56 bytes captured (448 bits)
Null/Loopback
Internet Protocol Version 4, Src: 128.131.210.185 (128.131.210.185), Dst: 128.131.210.185 (128.131.210.185)
Transmission Control Protocol, Src Port: lrs-paging (3700), Dst Port: 52403 (52403), Seq: 1, Ack: 271, Len: 0

No.     Time        Source                Destination           Protocol Length Info
    213 3.015432    128.131.210.185       128.131.210.185       GIOP     90     GIOP 1.2 Reply s=22 id=10: No Exception

Frame 213: 90 bytes on wire (720 bits), 90 bytes captured (720 bits)
Null/Loopback
Internet Protocol Version 4, Src: 128.131.210.185 (128.131.210.185), Dst: 128.131.210.185 (128.131.210.185)
Transmission Control Protocol, Src Port: lrs-paging (3700), Dst Port: 52403 (52403), Seq: 1, Ack: 271, Len: 34
General Inter-ORB Protocol
General Inter-ORB Protocol Reply

No.     Time        Source                Destination           Protocol Length Info
    214 3.015465    128.131.210.185       128.131.210.185       TCP      56     52403 > lrs-paging [ACK] Seq=271 Ack=35 Win=40813 Len=0 TSval=122855475 TSecr=122855475

Frame 214: 56 bytes on wire (448 bits), 56 bytes captured (448 bits)
Null/Loopback
Internet Protocol Version 4, Src: 128.131.210.185 (128.131.210.185), Dst: 128.131.210.185 (128.131.210.185)
Transmission Control Protocol, Src Port: 52403 (52403), Dst Port: lrs-paging (3700), Seq: 271, Ack: 35, Len: 0
